Dataset ID,Question,Category,Sub-Category,Difficulty,Source,Company
225,Tell me about a time when you had to work with a remote or distributed team.,Behavioral,Teamwork,Medium,Interview Prep,Slack
226,Describe a situation where you had to resolve a conflict between team members.,Behavioral,Teamwork,Medium,Interview Prep,Amazon
227,Tell me about a time when you had to collaborate with someone from a different department or background.,Behavioral,Teamwork,Medium,Interview Prep,IBM
228,Describe a situation where you had to contribute to a team project outside your primary responsibilities.,Behavioral,Teamwork,Medium,Interview Prep,Netflix
229,Tell me about a time when you had to give and receive feedback in a team setting.,Behavioral,Teamwork,Medium,Interview Prep,Google
230,Describe a situation where you had to build trust within a new team.,Behavioral,Teamwork,Medium,Interview Prep,Microsoft
231,Tell me about a time when you had to communicate a complex technical concept to a non-technical audience.,Behavioral,Communication,Medium,Interview Prep,Google
232,Describe a situation where you had to deliver difficult news to a client or stakeholder.,Behavioral,Communication,Hard,Interview Prep,Amazon
233,Tell me about a time when you had to persuade others to adopt your idea or approach.,Behavioral,Communication,Medium,Interview Prep,Apple
234,Describe a situation where you had to tailor your communication style for different audiences.,Behavioral,Communication,Medium,Interview Prep,Microsoft
235,Tell me about a time when miscommunication led to a problem and how you resolved it.,Behavioral,Communication,Medium,Interview Prep,Facebook
236,Describe a situation where you had to communicate effectively under pressure or tight deadlines.,Behavioral,Communication,Medium,Interview Prep,Netflix
237,Tell me about a time when you had to present complex data or findings to senior management.,Behavioral,Communication,Hard,Interview Prep,IBM
238,Describe a situation where you had to negotiate with internal or external stakeholders.,Behavioral,Communication,Medium,Interview Prep,Salesforce
239,Tell me about a time when you had to write a critical document or report for a project.,Behavioral,Communication,Medium,Interview Prep,Google
240,Describe a situation where you had to facilitate a meeting or discussion to achieve specific outcomes.,Behavioral,Communication,Medium,Interview Prep,Microsoft
241,Tell me about a time when you faced a complex problem that required creative thinking.,Behavioral,Problem Solving,Medium,Interview Prep,Google
242,Describe a situation where you had to solve a problem with limited resources or constraints.,Behavioral,Problem Solving,Medium,Interview Prep,Amazon
243,Tell me about a time when you identified and solved a problem before it became critical.,Behavioral,Problem Solving,Medium,Interview Prep,Microsoft
244,Describe a situation where you had to analyze data to solve a business problem.,Behavioral,Problem Solving,Medium,Interview Prep,Facebook
245,Tell me about a time when you had to develop an innovative solution to a challenging problem.,Behavioral,Problem Solving,Hard,Interview Prep,Apple
246,Describe a situation where you had to troubleshoot and resolve a technical issue.,Behavioral,Problem Solving,Medium,Interview Prep,IBM
247,Tell me about a time when you had to make a decision based on incomplete information.,Behavioral,Problem Solving,Medium,Interview Prep,Netflix
248,Describe a situation where you had to solve a problem that affected multiple teams or departments.,Behavioral,Problem Solving,Hard,Interview Prep,Google
249,Tell me about a time when you had to prioritize which problems to solve first.,Behavioral,Problem Solving,Medium,Interview Prep,Microsoft
250,Describe a situation where you had to use a systematic approach to solve a complex problem.,Behavioral,Problem Solving,Medium,Interview Prep,Amazon
251,Tell me about a time when you had to adapt to a significant change in the workplace.,Behavioral,Adaptability,Medium,Interview Prep,Google
252,Describe a situation where you had to learn a new technology or skill quickly to complete a project.,Behavioral,Adaptability,Medium,Interview Prep,Microsoft
253,Tell me about a time when you had to work outside your comfort zone.,Behavioral,Adaptability,Medium,Interview Prep,Amazon
254,Describe a situation where you had to adjust your approach due to changing requirements or priorities.,Behavioral,Adaptability,Medium,Interview Prep,Facebook
255,Tell me about a time when you had to be flexible in response to unexpected events or challenges.,Behavioral,Adaptability,Medium,Interview Prep,Apple
256,Describe a situation where you had to adapt to working with a new team or manager.,Behavioral,Adaptability,Medium,Interview Prep,Netflix
257,Tell me about a time when you had to pivot your strategy due to market changes or feedback.,Behavioral,Adaptability,Medium,Interview Prep,Uber
258,Describe a situation where you had to adapt to cultural differences in a work environment.,Behavioral,Adaptability,Medium,Interview Prep,Google
259,Tell me about a time when you had to embrace a new process or methodology.,Behavioral,Adaptability,Medium,Interview Prep,Microsoft
260,Describe a situation where you had to adapt to a remote or hybrid work environment.,Behavioral,Adaptability,Medium,Interview Prep,Slack
261,Tell me about a time when you had to manage multiple projects with competing deadlines.,Behavioral,Time Management,Medium,Interview Prep,Google
262,Describe a situation where you had to reprioritize your tasks due to an urgent request or changing priorities.,Behavioral,Time Management,Medium,Interview Prep,Microsoft
263,Tell me about a time when you had to meet a tight deadline with limited time.,Behavioral,Time Management,Medium,Interview Prep,Amazon
264,Describe a situation where you had to balance multiple responsibilities or projects simultaneously.,Behavioral,Time Management,Medium,Interview Prep,Facebook
265,Tell me about a time when you had to improve your efficiency to meet project timelines.,Behavioral,Time Management,Medium,Interview Prep,Apple
266,Describe a situation where you had to help a team member with time management issues.,Behavioral,Time Management,Medium,Interview Prep,Netflix
267,Tell me about a time when you had to create and follow a schedule to complete a complex project.,Behavioral,Time Management,Hard,Interview Prep,Google
268,Describe a situation where you had to decline additional work or responsibilities due to existing commitments.,Behavioral,Time Management,Medium,Interview Prep,Microsoft
269,Tell me about a time when you had to work extended hours to meet a deadline.,Behavioral,Time Management,Medium,Interview Prep,Amazon
270,Describe a situation where you had to implement a time management system or tool to improve productivity.,Behavioral,Time Management,Medium,Interview Prep,Asana
271,Tell me about a time when you had to make a difficult decision with limited information.,Behavioral,Decision Making,Medium,Interview Prep,Google
272,Describe a situation where you had to make an unpopular decision that was best for the business.,Behavioral,Decision Making,Hard,Interview Prep,Microsoft
273,Tell me about a time when you had to make a quick decision under pressure.,Behavioral,Decision Making,Medium,Interview Prep,Amazon
274,Describe a situation where you had to gather data or input from others before making a decision.,Behavioral,Decision Making,Medium,Interview Prep,Facebook
275,Tell me about a time when you made a decision that didn't work out as planned.,Behavioral,Decision Making,Medium,Interview Prep,Apple
276,Describe a situation where you had to make a strategic decision with long-term implications.,Behavioral,Decision Making,Hard,Interview Prep,Netflix
277,Tell me about a time when you had to choose between multiple good options.,Behavioral,Decision Making,Medium,Interview Prep,Google
278,Describe a situation where you had to make a decision that involved taking a calculated risk.,Behavioral,Decision Making,Medium,Interview Prep,Microsoft
279,Tell me about a time when you had to make a decision that affected your team or organization.,Behavioral,Decision Making,Medium,Interview Prep,Amazon
280,Describe a situation where you had to reverse a previous decision based on new information.,Behavioral,Decision Making,Medium,Interview Prep,Facebook
281,Tell me about a time when you had to resolve a conflict between team members.,Behavioral,Conflict Resolution,Medium,Interview Prep,Google
282,Describe a situation where you had to address a disagreement with your manager or a senior colleague.,Behavioral,Conflict Resolution,Hard,Interview Prep,Microsoft
283,Tell me about a time when you had to mediate a conflict between others.,Behavioral,Conflict Resolution,Medium,Interview Prep,Amazon
284,Describe a situation where you had to find a compromise between competing interests or viewpoints.,Behavioral,Conflict Resolution,Medium,Interview Prep,Facebook
285,Tell me about a time when you had to address a conflict with a client or external stakeholder.,Behavioral,Conflict Resolution,Hard,Interview Prep,Apple
286,Describe a situation where you had to resolve a conflict caused by miscommunication.,Behavioral,Conflict Resolution,Medium,Interview Prep,Netflix
287,Tell me about a time when you had to address a conflict in a remote or virtual team environment.,Behavioral,Conflict Resolution,Medium,Interview Prep,Slack
288,Describe a situation where you had to resolve a conflict involving cultural or personal differences.,Behavioral,Conflict Resolution,Medium,Interview Prep,Google
289,Tell me about a time when you had to address a conflict that was affecting team performance.,Behavioral,Conflict Resolution,Medium,Interview Prep,Microsoft
290,Describe a situation where you had to use negotiation skills to resolve a conflict.,Behavioral,Conflict Resolution,Medium,Interview Prep,Amazon
291,Tell me about a time when you took initiative on a project without being asked.,Behavioral,Initiative,Medium,Interview Prep,Google
292,Describe a situation where you identified and implemented a process improvement.,Behavioral,Initiative,Medium,Interview Prep,Microsoft
293,Tell me about a time when you went above and beyond your job responsibilities.,Behavioral,Initiative,Medium,Interview Prep,Amazon
294,Describe a situation where you identified a problem and took steps to fix it before being asked.,Behavioral,Initiative,Medium,Interview Prep,Facebook
295,Tell me about a time when you initiated a project that created value for your organization.,Behavioral,Initiative,Medium,Interview Prep,Apple
296,Describe a situation where you sought out additional responsibilities to develop your skills.,Behavioral,Initiative,Medium,Interview Prep,Netflix
297,Tell me about a time when you proposed and implemented a new idea or solution.,Behavioral,Initiative,Medium,Interview Prep,Google
298,Describe a situation where you took ownership of a project or task without being assigned.,Behavioral,Initiative,Medium,Interview Prep,Microsoft
299,Tell me about a time when you identified a gap in your knowledge and took steps to address it.,Behavioral,Initiative,Medium,Interview Prep,Amazon
300,Describe a situation where you initiated collaboration with another team or department.,Behavioral,Initiative,Medium,Interview Prep,Facebook
301,Tell me about a time when you had to deal with a difficult customer or client.,Behavioral,Customer Service,Medium,Interview Prep,Amazon
302,Describe a situation where you had to go above and beyond to meet a customer's needs.,Behavioral,Customer Service,Medium,Interview Prep,Apple
303,Tell me about a time when you had to turn an unhappy customer into a satisfied one.,Behavioral,Customer Service,Medium,Interview Prep,Zappos
304,Describe a situation where you had to balance customer satisfaction with business constraints.,Behavioral,Customer Service,Medium,Interview Prep,Microsoft
305,Tell me about a time when you had to say no to a customer request.,Behavioral,Customer Service,Hard,Interview Prep,Google
306,Describe a situation where you had to manage customer expectations during a challenging situation.,Behavioral,Customer Service,Medium,Interview Prep,Amazon
307,Tell me about a time when you received feedback from a customer and used it to improve a product or service.,Behavioral,Customer Service,Medium,Interview Prep,Apple
308,Describe a situation where you had to handle multiple customer inquiries or issues simultaneously.,Behavioral,Customer Service,Medium,Interview Prep,Zendesk
309,Tell me about a time when you had to explain a technical issue to a non-technical customer.,Behavioral,Customer Service,Medium,Interview Prep,Microsoft
310,Describe a situation where you had to implement or improve a customer service process.,Behavioral,Customer Service,Medium,Interview Prep,Salesforce
311,Tell me about a time when you had to learn from a failure or mistake.,Behavioral,Resilience,Medium,Interview Prep,Google
312,Describe a situation where you faced a significant setback and how you overcame it.,Behavioral,Resilience,Medium,Interview Prep,Microsoft
313,Tell me about a time when you received critical feedback and how you responded to it.,Behavioral,Resilience,Medium,Interview Prep,Amazon
314,Describe a situation where you had to persist through multiple obstacles to achieve a goal.,Behavioral,Resilience,Hard,Interview Prep,Facebook
315,Tell me about a time when you had to bounce back from a professional disappointment.,Behavioral,Resilience,Medium,Interview Prep,Apple
316,Describe a situation where you had to maintain a positive attitude during a challenging project.,Behavioral,Resilience,Medium,Interview Prep,Netflix
317,Tell me about a time when you had to adapt to a significant change or setback.,Behavioral,Resilience,Medium,Interview Prep,Google
318,Describe a situation where you had to persevere through a long-term challenge.,Behavioral,Resilience,Medium,Interview Prep,Microsoft
319,Tell me about a time when you had to manage stress during a high-pressure situation.,Behavioral,Resilience,Medium,Interview Prep,Amazon
320,Describe a situation where you had to motivate yourself to continue despite difficulties.,Behavioral,Resilience,Medium,Interview Prep,Facebook
321,Tell me about a time when you had to set and achieve a challenging personal or professional goal.,Behavioral,Goal Setting,Medium,Interview Prep,Google
322,Describe a situation where you had to establish metrics to track progress toward a goal.,Behavioral,Goal Setting,Medium,Interview Prep,Microsoft
323,Tell me about a time when you had to adjust your goals due to changing circumstances.,Behavioral,Goal Setting,Medium,Interview Prep,Amazon
324,Describe a situation where you helped a team member set and achieve their goals.,Behavioral,Goal Setting,Medium,Interview Prep,Facebook
325,Tell me about a time when you failed to meet a goal and what you learned from it.,Behavioral,Goal Setting,Medium,Interview Prep,Apple
326,Describe a situation where you had to break down a large goal into manageable steps.,Behavioral,Goal Setting,Medium,Interview Prep,Netflix
327,Tell me about a time when you had to align your personal goals with organizational objectives.,Behavioral,Goal Setting,Medium,Interview Prep,Google
328,Describe a situation where you had to prioritize between competing goals.,Behavioral,Goal Setting,Medium,Interview Prep,Microsoft
329,Tell me about a time when you had to set ambitious but realistic goals for a project.,Behavioral,Goal Setting,Medium,Interview Prep,Amazon
330,Describe a situation where you had to create a plan to achieve a long-term goal.,Behavioral,Goal Setting,Medium,Interview Prep,Facebook
331,Tell me about a time when you had to mentor or coach someone.,Behavioral,Mentoring,Medium,Interview Prep,Google
332,Describe a situation where you helped a colleague develop their skills.,Behavioral,Mentoring,Medium,Interview Prep,Microsoft
333,Tell me about a time when you had to provide constructive feedback to help someone improve.,Behavioral,Mentoring,Medium,Interview Prep,Amazon
334,Describe a situation where you had to adapt your coaching style to different individuals.,Behavioral,Mentoring,Medium,Interview Prep,Facebook
335,Tell me about a time when you helped someone overcome a performance challenge.,Behavioral,Mentoring,Medium,Interview Prep,Apple
336,Describe a situation where you had to mentor someone from a different background or experience level.,Behavioral,Mentoring,Medium,Interview Prep,Netflix
337,Tell me about a time when you had to balance being supportive with challenging someone to grow.,Behavioral,Mentoring,Medium,Interview Prep,Google
338,Describe a situation where you had to create a development plan for a team member.,Behavioral,Mentoring,Medium,Interview Prep,Microsoft
339,Tell me about a time when you had to provide guidance during a difficult situation.,Behavioral,Mentoring,Medium,Interview Prep,Amazon
340,Describe a situation where you had to identify and nurture potential in someone else.,Behavioral,Mentoring,Medium,Interview Prep,Facebook
341,Tell me about a time when you had to work with people from different cultural backgrounds.,Behavioral,Diversity & Inclusion,Medium,Interview Prep,Google
342,Describe a situation where you had to address unconscious bias in the workplace.,Behavioral,Diversity & Inclusion,Medium,Interview Prep,Microsoft
343,Tell me about a time when you had to ensure diverse perspectives were included in a decision.,Behavioral,Diversity & Inclusion,Medium,Interview Prep,Amazon
344,Describe a situation where you had to adapt your communication style for cultural differences.,Behavioral,Diversity & Inclusion,Medium,Interview Prep,Facebook
345,Tell me about a time when you had to create an inclusive environment for team members.,Behavioral,Diversity & Inclusion,Medium,Interview Prep,Apple
346,Describe a situation where you had to advocate for diversity or inclusion in your workplace.,Behavioral,Diversity & Inclusion,Medium,Interview Prep,Netflix
347,Tell me about a time when you learned from someone with a different background or perspective.,Behavioral,Diversity & Inclusion,Medium,Interview Prep,Google
348,Describe a situation where you had to address exclusionary behavior or language.,Behavioral,Diversity & Inclusion,Hard,Interview Prep,Microsoft
349,Tell me about a time when diversity in a team led to better outcomes or innovation.,Behavioral,Diversity & Inclusion,Medium,Interview Prep,Amazon
350,Describe a situation where you had to ensure equitable treatment or opportunities for all team members.,Behavioral,Diversity & Inclusion,Medium,Interview Prep,Facebook
351,Tell me about a time when you had to manage a project from start to finish.,Behavioral,Project Management,Medium,Interview Prep,Google
352,Describe a situation where you had to coordinate resources across multiple teams or departments.,Behavioral,Project Management,Medium,Interview Prep,Microsoft
353,Tell me about a time when you had to adjust a project plan due to unexpected challenges.,Behavioral,Project Management,Medium,Interview Prep,Amazon
354,Describe a situation where you had to manage stakeholder expectations during a project.,Behavioral,Project Management,Medium,Interview Prep,Facebook
355,Tell me about a time when you had to lead a project with limited authority over team members.,Behavioral,Project Management,Hard,Interview Prep,Apple
356,Describe a situation where you had to manage scope creep in a project.,Behavioral,Project Management,Medium,Interview Prep,Netflix
357,Tell me about a time when you had to track and report on project metrics or KPIs.,Behavioral,Project Management,Medium,Interview Prep,Google
358,Describe a situation where you had to manage risks in a complex project.,Behavioral,Project Management,Medium,Interview Prep,Microsoft
359,Tell me about a time when you had to manage a project with tight budget constraints.,Behavioral,Project Management,Medium,Interview Prep,Amazon
360,Describe a situation where you had to close out a project and capture lessons learned.,Behavioral,Project Management,Medium,Interview Prep,Facebook